{
  "title": "OCR phiếu chấm công — module REC v0.2",
  "version": {
    "model": "rec-v0.2",
    "dataset": "ds-v3 (real 60 + synth 12k)"
  },
  "baseline_name": "rec-v0.1",
  "overview": {
    "status": "Version trước rec-v0.1 đạt exact match từng trường như bảng dưới trên val real 60 trang (cùng tập với version này). Issue đang xử lý: giờ bắt đầu và ngày hay sai khi in mờ; mã NV nhầm 0/O.",
    "method": "Giờ bắt đầu/ngày: thêm augmentation nhiễu in mờ vào train (12k synth + 60 real, 90/10). Mã NV: chưa xử lý trong vòng này (chờ font dot-matrix cho synth). Cách đánh giá giữ nguyên.",
    "result": "Ngày +5.0 và Giờ bắt đầu +5.0 điểm exact match, Mã NV +1.7 điểm (trong sai số, n=60). Còn tồn tại: nhầm 0/O ở mã NV, giờ nghỉ bị cắt nét. Giờ kết thúc: chưa đánh giá."
  },
  "tables": [
    {
      "name": "Phiếu chấm công (KIE)",
      "rows": [
        {
          "item": "Ngày",
          "correct": 58,
          "total": 60,
          "baseline_correct": 55
        },
        {
          "item": "Giờ bắt đầu",
          "correct": 55,
          "total": 60,
          "baseline_correct": 52
        },
        {
          "item": "Mã NV",
          "correct": 54,
          "total": 60,
          "baseline_correct": 53
        },
        {
          "item": "Giờ kết thúc"
        }
      ],
      "metric": "exact match (accuracy)",
      "eval_set": "val real 60 trang"
    }
  ],
  "errors": [
    {
      "cluster": "Nhầm 0/O, 1/l ở mã NV",
      "count": 6,
      "cause": "Giả thuyết: synth thiếu font in kim.",
      "examples": [
        {
          "where": "trang 12, dòng 3",
          "note": "O đọc thành 0"
        }
      ],
      "denominator": 60,
      "fields": "Mã NV",
      "example": "trang 12, dòng 3 — O đọc thành 0"
    },
    {
      "cluster": "Giờ nghỉ bị cắt nét",
      "count": 5,
      "cause": "Đã xác nhận: crop layout quá sát.",
      "examples": [
        {
          "where": "trang 31, dòng 7"
        }
      ],
      "denominator": 60,
      "fields": "Giờ nghỉ",
      "example": "trang 31, dòng 7"
    }
  ],
  "conclusion": {
    "fixes": [
      {
        "error": "Nhầm 0/O",
        "fix": "Thêm font dot-matrix vào synth + hậu xử lý theo regex mã NV",
        "priority": "P1",
        "measure": "Mã NV ≥ 58/60 trên val real"
      },
      {
        "error": "Giờ nghỉ bị cắt",
        "fix": "Nới padding crop 4px",
        "priority": "P2",
        "measure": "Giờ nghỉ ≥ 57/60"
      }
    ],
    "recommend": "Chưa nên thay checkpoint production; giữ rec-v0.1 cho tới khi Mã NV ≥ 96%."
  },
  "artifacts": [
    {
      "label": "eval.json",
      "path": "eval.sample.json"
    }
  ]
}